{
  "name": "Boundless Recommended Priority List",
  "schemaVersion": {
    "major": 1,
    "minor": 0
  },
  "version": {
    "major": 1,
    "minor": 0
  },
  "requestors": [
    {
      "address": "0xc4ce4f04b9907a9401a0ed7ef073dffebab52aab",
      "chainId": 1,
      "priority": 0,
      "name": "Alpha Requestor",
      "estimatedMcycleCountMin": 100,
      "estimatedMcycleCountMax": 100,
      "estimatedMaxInputSizeMB": 10,
      "tags": []
    },
    {
      "address": "0x734df7809c4ef94da037449c287166d114503198",
      "chainId": 1,
      "priority": 0,
      "name": "Beta Requestor",
      "estimatedMcycleCountMin": 100,
      "estimatedMcycleCountMax": 100,
      "estimatedMaxInputSizeMB": 10,
      "tags": []
    },
    {
      "address": "0x382bba7d7bc9ae86c5de3e16c4ca96bcc0a3478e",
      "chainId": 1,
      "priority": 0,
      "name": "Gamma Requestor",
      "estimatedMcycleCountMin": 100,
      "estimatedMcycleCountMax": 100,
      "estimatedMaxInputSizeMB": 10,
      "tags": []
    },
    {
      "address": "0xf353bda16a83399c11e09615ee7ac326a5a08ccf",
      "chainId": 1,
      "priority": 0,
      "name": "Delta Requestor",
      "estimatedMcycleCountMin": 100,
      "estimatedMcycleCountMax": 100,
      "estimatedMaxInputSizeMB": 10,
      "tags": []
    }
  ]
}
